{
  "$schema": "./schemas/official-coverage.schema.json",
  "sourceId": "kalshi-openapi-rest",
  "generatedAt": "2026-10-11T05:44:05.819Z",
  "operationCount": 118,
  "operations": [
    {
      "operationId": "UpgradeAccountApiUsageLevel",
      "path": "/account/api_usage_level/upgrade",
      "method": "POST",
      "status": "unreviewed"
    },
    {
      "operationId": "GetAccountApiUsageLevelVolumeProgress",
      "path": "/account/api_usage_level/volume_progress",
      "method": "GET",
      "status": "unreviewed"
    },
    {
      "operationId": "GetAccountEndpointCosts",
      "path": "/account/endpoint_costs",
      "method": "GET",
      "status": "unreviewed"
    },
    {
      "operationId": "GetAccountApiLimits",
      "path": "/account/limits",
      "method": "GET",
      "status": "unreviewed"
    },
    {
      "operationId": "GetApiKeys",
      "path": "/api_keys",
      "method": "GET",
      "status": "unreviewed"
    },
    {
      "operationId": "CreateApiKey",
      "path": "/api_keys",
      "method": "POST",
      "status": "unreviewed"
    },
    {
      "operationId": "DeleteApiKey",
      "path": "/api_keys/{api_key}",
      "method": "DELETE",
      "status": "unreviewed"
    },
    {
      "operationId": "GenerateApiKey",
      "path": "/api_keys/generate",
      "method": "POST",
      "status": "unreviewed"
    },
    {
      "operationId": "GetBlockTradeProposals",
      "path": "/communications/block-trade-proposals",
      "method": "GET",
      "status": "unreviewed"
    },
    {
      "operationId": "ProposeBlockTrade",
      "path": "/communications/block-trade-proposals",
      "method": "POST",
      "status": "unreviewed"
    },
    {
      "operationId": "AcceptBlockTradeProposal",
      "path": "/communications/block-trade-proposals/{block_trade_proposal_id}/accept",
      "method": "POST",
      "status": "unreviewed"
    },
    {
      "operationId": "GetCommunicationsID",
      "path": "/communications/id",
      "method": "GET",
      "status": "unreviewed"
    },
    {
      "operationId": "GetQuotes",
      "path": "/communications/quotes",
      "method": "GET",
      "status": "unreviewed"
    },
    {
      "operationId": "CreateQuote",
      "path": "/communications/quotes",
      "method": "POST",
      "status": "unreviewed"
    },
    {
      "operationId": "DeleteQuote",
      "path": "/communications/quotes/{quote_id}",
      "method": "DELETE",
      "status": "unreviewed"
    },
    {
      "operationId": "GetQuote",
      "path": "/communications/quotes/{quote_id}",
      "method": "GET",
      "status": "unreviewed"
    },
    {
      "operationId": "AcceptQuote",
      "path": "/communications/quotes/{quote_id}/accept",
      "method": "PUT",
      "status": "unreviewed"
    },
    {
      "operationId": "ConfirmQuote",
      "path": "/communications/quotes/{quote_id}/confirm",
      "method": "PUT",
      "status": "unreviewed"
    },
    {
      "operationId": "GetRFQs",
      "path": "/communications/rfqs",
      "method": "GET",
      "status": "unreviewed"
    },
    {
      "operationId": "CreateRFQ",
      "path": "/communications/rfqs",
      "method": "POST",
      "status": "unreviewed"
    },
    {
      "operationId": "DeleteRFQ",
      "path": "/communications/rfqs/{rfq_id}",
      "method": "DELETE",
      "status": "unreviewed"
    },
    {
      "operationId": "GetRFQ",
      "path": "/communications/rfqs/{rfq_id}",
      "method": "GET",
      "status": "unreviewed"
    },
    {
      "operationId": "DeleteRFQQuote",
      "path": "/communications/rfqs/{rfq_id}/quotes/{quote_id}",
      "method": "DELETE",
      "status": "unreviewed"
    },
    {
      "operationId": "GetRFQQuote",
      "path": "/communications/rfqs/{rfq_id}/quotes/{quote_id}",
      "method": "GET",
      "status": "unreviewed"
    },
    {
      "operationId": "AcceptRFQQuote",
      "path": "/communications/rfqs/{rfq_id}/quotes/{quote_id}/accept",
      "method": "PUT",
      "status": "unreviewed"
    },
    {
      "operationId": "ConfirmRFQQuote",
      "path": "/communications/rfqs/{rfq_id}/quotes/{quote_id}/confirm",
      "method": "PUT",
      "status": "unreviewed"
    },
    {
      "operationId": "GetEvents",
      "path": "/events",
      "method": "GET",
      "status": "unreviewed"
    },
    {
      "operationId": "GetEvent",
      "path": "/events/{event_ticker}",
      "method": "GET",
      "status": "unreviewed"
    },
    {
      "operationId": "GetEventMetadata",
      "path": "/events/{event_ticker}/metadata",
      "method": "GET",
      "status": "unreviewed"
    },
    {
      "operationId": "GetEventFeeChanges",
      "path": "/events/fee_changes",
      "method": "GET",
      "status": "unreviewed"
    },
    {
      "operationId": "GetMultivariateEvents",
      "path": "/events/multivariate",
      "method": "GET",
      "status": "unreviewed"
    },
    {
      "operationId": "GetExchangeSchedule",
      "path": "/exchange/schedule",
      "method": "GET",
      "status": "unreviewed"
    },
    {
      "operationId": "GetExchangeStatus",
      "path": "/exchange/status",
      "method": "GET",
      "status": "unreviewed"
    },
    {
      "operationId": "GetUserDataTimestamp",
      "path": "/exchange/user_data_timestamp",
      "method": "GET",
      "status": "unreviewed"
    },
    {
      "operationId": "GetFCMFills",
      "path": "/fcm/fills",
      "method": "GET",
      "status": "unreviewed"
    },
    {
      "operationId": "GetFCMOrders",
      "path": "/fcm/orders",
      "method": "GET",
      "status": "unreviewed"
    },
    {
      "operationId": "GetFCMPositions",
      "path": "/fcm/positions",
      "method": "GET",
      "status": "unreviewed"
    },
    {
      "operationId": "CreateFCMPositionTransfer",
      "path": "/fcm/positions/transfers",
      "method": "POST",
      "status": "unreviewed"
    },
    {
      "operationId": "ListFCMSubtraders",
      "path": "/fcm/subtraders",
      "method": "GET",
      "status": "unreviewed"
    },
    {
      "operationId": "CreateFCMSubtrader",
      "path": "/fcm/subtraders",
      "method": "POST",
      "status": "unreviewed"
    },
    {
      "operationId": "GetFCMSubtraderBlockedCategories",
      "path": "/fcm/subtraders/blocked_categories",
      "method": "GET",
      "status": "unreviewed"
    },
    {
      "operationId": "UpdateFCMSubtraderBlockedCategories",
      "path": "/fcm/subtraders/blocked_categories",
      "method": "PUT",
      "status": "unreviewed"
    },
    {
      "operationId": "DeleteFCMEventContractDailyCap",
      "path": "/fcm/subtraders/event_contract_daily_cap",
      "method": "DELETE",
      "status": "unreviewed"
    },
    {
      "operationId": "GetFCMEventContractDailyCap",
      "path": "/fcm/subtraders/event_contract_daily_cap",
      "method": "GET",
      "status": "unreviewed"
    },
    {
      "operationId": "UpdateFCMEventContractDailyCap",
      "path": "/fcm/subtraders/event_contract_daily_cap",
      "method": "PUT",
      "status": "unreviewed"
    },
    {
      "operationId": "GetHistoricalCutoff",
      "path": "/historical/cutoff",
      "method": "GET",
      "status": "unreviewed"
    },
    {
      "operationId": "GetFillsHistorical",
      "path": "/historical/fills",
      "method": "GET",
      "status": "unreviewed"
    },
    {
      "operationId": "GetHistoricalMarkets",
      "path": "/historical/markets",
      "method": "GET",
      "status": "unreviewed"
    },
    {
      "operationId": "GetHistoricalMarket",
      "path": "/historical/markets/{ticker}",
      "method": "GET",
      "status": "unreviewed"
    },
    {
      "operationId": "GetMarketCandlesticksHistorical",
      "path": "/historical/markets/{ticker}/candlesticks",
      "method": "GET",
      "status": "unreviewed"
    },
    {
      "operationId": "GetHistoricalOrders",
      "path": "/historical/orders",
      "method": "GET",
      "status": "unreviewed"
    },
    {
      "operationId": "GetHistoricalPositions",
      "path": "/historical/positions",
      "method": "GET",
      "status": "unreviewed"
    },
    {
      "operationId": "GetTradesHistorical",
      "path": "/historical/trades",
      "method": "GET",
      "status": "unreviewed"
    },
    {
      "operationId": "GetIncentivePrograms",
      "path": "/incentive_programs",
      "method": "GET",
      "status": "unreviewed"
    },
    {
      "operationId": "GetLiveData",
      "path": "/live_data/{type}/milestone/{milestone_id}",
      "method": "GET",
      "status": "unreviewed"
    },
    {
      "operationId": "GetLiveDatas",
      "path": "/live_data/batch",
      "method": "GET",
      "status": "unreviewed"
    },
    {
      "operationId": "GetEventLiveData",
      "path": "/live_data/events/{event_ticker}",
      "method": "GET",
      "status": "unreviewed"
    },
    {
      "operationId": "GetLiveDataByMilestone",
      "path": "/live_data/milestone/{milestone_id}",
      "method": "GET",
      "status": "unreviewed"
    },
    {
      "operationId": "GetGameStats",
      "path": "/live_data/milestone/{milestone_id}/game_stats",
      "method": "GET",
      "status": "unreviewed"
    },
    {
      "operationId": "GetWeatherIndex",
      "path": "/live_data/weather/{city}",
      "method": "GET",
      "status": "unreviewed"
    },
    {
      "operationId": "GetWeatherIndexCalibrations",
      "path": "/live_data/weather/{city}/calibrations",
      "method": "GET",
      "status": "unreviewed"
    },
    {
      "operationId": "GetMarkets",
      "path": "/markets",
      "method": "GET",
      "status": "unreviewed"
    },
    {
      "operationId": "GetMarket",
      "path": "/markets/{ticker}",
      "method": "GET",
      "status": "unreviewed"
    },
    {
      "operationId": "GetMarketOrderbook",
      "path": "/markets/{ticker}/orderbook",
      "method": "GET",
      "status": "unreviewed"
    },
    {